question,response_a,response_b
"How do I stay focused while studying?","Try the Pomodoro technique: study for 25 minutes, then take a 5-minute break. Remove distractions like your phone and study in a quiet place.","Just focus harder. Stop being distracted. If you can't focus you're not trying hard enough."
"What is machine learning?","Machine learning is a type of AI where computers learn from data to make predictions or decisions without being explicitly programmed for each task.","Machine learning is when machines learn stuff. It's part of AI and computers use it."
"How do I improve my communication skills?","Practice active listening, read regularly, join groups like Toastmasters, and consciously work on clarity when speaking or writing.","Communication is important. You should talk to people more often."
"Explain what a neural network is","A neural network is a system of algorithms inspired by the human brain. It processes data through layers of connected nodes to recognize patterns and make decisions.","Neural networks are like brains but in computers. They have layers and nodes that connect."
"What should I eat to stay healthy?","A balanced diet with vegetables, fruits, whole grains, lean protein, and healthy fats is recommended. Stay hydrated and limit processed food and sugar.","You should eat healthy food and avoid junk food. Drink water too."
```
